{
  "schemaVersion": 1,
  "status": "ready",
  "category": "travel",
  "id": 16,
  "slug": "travel-16",
  "title": "イラフ SUI の122号室で",
  "date": "2026-07-13",
  "locationTag": "沖縄県宮古島市",
  "heroSubtitle": "プール付きの部屋で過ごした、二泊。",
  "listingDescription": "イラフ SUI ラグジュアリーコレクションホテル 沖縄宮古の122号室に二泊した記録。プール付きの部屋で、だらだら過ごした時間。",
  "body": {
    "raw": "122号室には、プールがついていた。\n「今日は何もしなくていいか」と思える景色だった。\n実際、その日はほとんど部屋で過ごした。\n\n相方は丸いソファにタオルを敷いて昼寝。\n心地よい風と遠くの波の音が気持ちよかったらしい。\n\n---\n\nベッドは、ゆったり二つ分。\n枕は一人につき4つ。柔らかめと普通の硬さが2つずつ用意されていて、好みに合わせて選べた。\n気づけば、眠くなっていた。\n\n---\n\n窓際には、寝転がれるソファ。\n本を持ってくればよかった、と思った。\n\n---\n\n洗面台は、シンクが二つ。\n朝、混み合わないのがありがたい。\n\n---\n\nテーブルには、ウェルカムのお菓子とフルーツ。\n手紙も一枚、添えられていた。\n\n---\n\nバスルームは、ガラス張り。\n明るくて、思ったより開放感がある。\n\n---\n\n特別なことは、していない。\n\nプールに入って、部屋でだらだらして、また入る。\nそれだけで、二泊があっという間だった。",
    "sections": [
      {
        "type": "photo",
        "paragraphs": [
          "122号室には、プールがついていた。<br>「今日は何もしなくていいか」と思える景色だった。<br>実際、その日はほとんど部屋で過ごした。",
          "相方は丸いソファにタオルを敷いて昼寝。<br>心地よい風と遠くの波の音が気持ちよかったらしい。"
        ]
      },
      {
        "type": "photo",
        "paragraphs": [
          "ベッドは、ゆったり二つ分。<br>枕は一人につき4つ。柔らかめと普通の硬さが2つずつ用意されていて、好みに合わせて選べた。<br>気づけば、眠くなっていた。"
        ]
      },
      {
        "type": "photo",
        "paragraphs": [
          "窓際には、寝転がれるソファ。<br>本を持ってくればよかった、と思った。"
        ]
      },
      {
        "type": "photo",
        "paragraphs": [
          "洗面台は、シンクが二つ。<br>朝、混み合わないのがありがたい。"
        ]
      },
      {
        "type": "photo",
        "paragraphs": [
          "テーブルには、ウェルカムのお菓子とフルーツ。<br>手紙も一枚、添えられていた。"
        ]
      },
      {
        "type": "photo",
        "paragraphs": [
          "バスルームは、ガラス張り。<br>明るくて、思ったより開放感がある。"
        ]
      },
      {
        "type": "text",
        "paragraphs": [
          "特別なことは、していない。",
          "プールに入って、部屋でだらだらして、また入る。<br>それだけで、二泊があっという間だった。"
        ]
      }
    ]
  },
  "build": {
    "orientation": "landscape",
    "imageFolder": "sui",
    "imagePrefix": "sui-",
    "seo": {
      "description": "イラフ SUI ラグジュアリーコレクションホテル 沖縄宮古の122号室に二泊した記録。プール付きの部屋で、だらだら過ごした時間。"
    },
    "photos": [
      {
        "index": 1,
        "alt": "122号室のプライベートプール",
        "width": 1477,
        "height": 1108,
        "variants": [400, 800, 1477]
      },
      {
        "index": 2,
        "alt": "122号室のベッド",
        "width": 1477,
        "height": 1108,
        "variants": [400, 800, 1477]
      },
      {
        "index": 3,
        "alt": "窓際のソファ",
        "width": 835,
        "height": 627,
        "variants": [400, 835]
      },
      {
        "index": 4,
        "alt": "ダブルシンクの洗面台",
        "width": 1477,
        "height": 1108,
        "variants": [400, 800, 1477]
      },
      {
        "index": 5,
        "alt": "ウェルカムのお菓子とフルーツ",
        "width": 1108,
        "height": 1477,
        "variants": [400, 800, 1108]
      },
      {
        "index": 6,
        "alt": "ガラス張りのバスルーム",
        "width": 1477,
        "height": 1108,
        "variants": [400, 800, 1477]
      }
    ],
    "ogImage": {
      "filename": "sui-og.jpg",
      "width": 1200,
      "height": 630
    },
    "sidebar": {
      "places": [
        {
          "label": "イラフ SUI ラグジュアリーコレクションホテル 沖縄宮古",
          "detail": "宿泊：122号室（二泊）",
          "mapQuery": "イラフSUI ラグジュアリーコレクションホテル 宮古島",
          "zoom": 14,
          "iframeHeight": 220
        }
      ]
    }
  },
  "meta": {
    "createdAt": "2026-07-24T08:00:00.000Z",
    "updatedAt": "2026-07-24T08:00:00.000Z",
    "source": "iphone-form-v1"
  }
}
